{
  "$schema": "./releases.schema.json",
  "schemaVersion": 3,
  "mock": false,
  "generatedAt": "2026-10-13T21:15:20+08:00",
  "minimumVersions": {
    "taishin": "1.6.0",
    "zf-mega": "1.6.0",
    "capital": "1.6.0"
  },
  "product": {
    "name": "QtOrder",
    "repositoryUrl": "https://github.com/ProjectOnTitan/QtOrderRelease",
    "requirements": [
      "Windows 10 或 Windows 11（64 位元）",
      "安裝時需要系統管理員權限，用來註冊券商下單元件與安裝必要元件",
      "穩定的網路連線"
    ],
    "brokerRequirements": [
      {
        "broker": "台新證券",
        "items": [
          "交易憑證（.pfx）"
        ]
      },
      {
        "broker": "兆豐證券",
        "items": [
          "交易憑證（.pfx）"
        ]
      },
      {
        "broker": "群益證券",
        "items": [
          "交易憑證（.pfx）",
          "已開通 API 下單權限並簽署相關同意書",
          "已完成群益 API 連線測試"
        ]
      }
    ],
    "components": [
      {
        "name": ".NET Framework 4.8",
        "purpose": "QtOrder 的執行環境；Windows 10 1903 以後與 Windows 11 已內建",
        "brokers": [
          "taishin",
          "zf-mega",
          "capital"
        ],
        "url": "https://dotnet.microsoft.com/download/dotnet-framework/net48"
      },
      {
        "name": "Microsoft Visual C++ v14 可轉散發套件（x64）",
        "purpose": "券商下單與查詢元件需要的 C++ 執行階段",
        "brokers": [
          "taishin",
          "zf-mega"
        ],
        "url": "https://aka.ms/vc14/vc_redist.x64.exe"
      },
      {
        "name": "Node.js 16 以上",
        "purpose": "查詢昨收、庫存與交割戶餘額；安裝程式自動安裝時裝 LTS 版",
        "brokers": [
          "taishin"
        ],
        "url": "https://nodejs.org/"
      }
    ]
  },
  "releases": [
    {
      "version": "1.6.0",
      "channel": "stable",
      "publishedAt": "2026-10-13T17:49:43+08:00",
      "sourceCommit": "276b643668b9f27ba9f4bed9aab365ce28543208",
      "requiresInstaller": true,
      "summary": "第一個從 QtOrder 發布中心提供的版本，自動更新改由發布中心提供並核對下載檔案。",
      "releaseUrl": "https://github.com/ProjectOnTitan/QtOrderRelease/releases/tag/v1.6.0",
      "notes": {
        "upgradeNotes": [
          "這是第一個從發布中心提供的版本，請下載安裝程式安裝；先前取得的 QtOrder（含舊名 BullionTrader）無法自動更新到這一版",
          "安裝程式不含訊號服務金鑰：請向券商取得金鑰檔，存放為所選券商安裝目錄下的 `app.local.config`（例如 `C:\\QtOrder\\zf-mega\\app.local.config`），否則無法啟動交易監控",
          "公司或券商有防火牆時，請放行發布中心「安裝與驗證」列出的網域，啟動器才收得到更新"
        ],
        "improvements": [
          "自動更新改由 QtOrder 發布中心提供，下載後會核對檔案的 SHA-256 與大小，不符就不套用",
          "啟動器只會更新到較新的版本，切換發布通道時不會退回舊版",
          "連不上更新伺服器時，啟動器會在倒數 10 秒後啟動目前的版本",
          "所有下單都需要有效的軟體授權；連不上授權主機時，以離線票證繼續運作並提醒客戶",
          "收到缺少或無法解析目標股數的訊號時改為拒收，不再當成平倉",
          "設定頁的發布通道改稱「穩定版」與「預覽版」"
        ],
        "features": [
          "台新、兆豐與群益分別提供安裝程式，各自保存設定與更新狀態",
          "請依實際使用券商下載；舊設定需手動遷移，軟體授權需重新啟用"
        ]
      },
      "assets": [
        {
          "name": "Setup_QtOrder_taishin_v1.6.0.exe",
          "broker": "taishin",
          "kind": "installer",
          "size": 21972319,
          "sha256": "7b3ae48bfa0ffbf0e26f27378c795f1a721749175263388f520d8f192c3a4e5c",
          "url": "https://github.com/ProjectOnTitan/QtOrderRelease/releases/download/v1.6.0/Setup_QtOrder_taishin_v1.6.0.exe"
        },
        {
          "name": "QtOrder_taishin_v1.6.0.zip",
          "broker": "taishin",
          "kind": "update",
          "size": 22525158,
          "sha256": "bd806f88de5abcffd1e703e29fc21cd6ff6513a42bb2bb929d0ed515c10bc996",
          "url": "https://github.com/ProjectOnTitan/QtOrderRelease/releases/download/v1.6.0/QtOrder_taishin_v1.6.0.zip"
        },
        {
          "name": "Setup_QtOrder_zf-mega_v1.6.0.exe",
          "broker": "zf-mega",
          "kind": "installer",
          "size": 17058468,
          "sha256": "5088a2d69f20462941bee5018cccdbe3c4728ad40907eb514892c1ff26812b5b",
          "url": "https://github.com/ProjectOnTitan/QtOrderRelease/releases/download/v1.6.0/Setup_QtOrder_zf-mega_v1.6.0.exe"
        },
        {
          "name": "QtOrder_zf-mega_v1.6.0.zip",
          "broker": "zf-mega",
          "kind": "update",
          "size": 16372852,
          "sha256": "4452d3af4d8c2b836c6b8290cb8e6309804e8a6ea8ef5b7c5f959dbef35da57d",
          "url": "https://github.com/ProjectOnTitan/QtOrderRelease/releases/download/v1.6.0/QtOrder_zf-mega_v1.6.0.zip"
        },
        {
          "name": "Setup_QtOrder_capital_v1.6.0.exe",
          "broker": "capital",
          "kind": "installer",
          "size": 23015417,
          "sha256": "633034025d9bc266e83323a56d087790f0983a76f3fa50bf054c815cfb399205",
          "url": "https://github.com/ProjectOnTitan/QtOrderRelease/releases/download/v1.6.0/Setup_QtOrder_capital_v1.6.0.exe"
        },
        {
          "name": "QtOrder_capital_v1.6.0.zip",
          "broker": "capital",
          "kind": "update",
          "size": 24154183,
          "sha256": "9893a7213d431c434dc8c84714b648140457811b8e2cdd63ef7288b8bc7d4466",
          "url": "https://github.com/ProjectOnTitan/QtOrderRelease/releases/download/v1.6.0/QtOrder_capital_v1.6.0.zip"
        }
      ]
    }
  ]
}
